{
  "$schema": "https://json-schema.org/draft/2020-12/schema",
  "$id": "https://github.com/chatgptopenaiagi/ARX/schemas/agent-dna.schema.json",
  "title": "ARX Agent DNA Snapshot (experimental)",
  "type": "object",
  "required": ["schema_version", "snapshot_id", "producer", "generated_at", "agent", "machine_reference", "execution_context", "policy", "capabilities", "capability_graph", "contradictions", "interventions", "calibration", "unknowns", "summary"],
  "properties": {
    "schema_version": {"const": "agent-dna/0.1"},
    "snapshot_id": {"type": "string", "pattern": "^agent-dna-snapshot:"},
    "producer": {"type": "object", "required": ["name", "version", "source_schema"]},
    "generated_at": {"type": "string"},
    "agent": {"type": "object", "required": ["name"]},
    "machine_reference": {"type": "object", "required": ["status"]},
    "execution_context": {"type": "object"},
    "policy": {"type": "object", "required": ["profile", "mutation_boundary", "remote_mutation", "dangerous_probes"]},
    "capabilities": {
      "type": "array",
      "items": {"$ref": "#/$defs/capability"}
    },
    "capability_graph": {
      "type": "object",
      "required": ["node_ids", "edges", "unresolved_dependency_ids"],
      "properties": {
        "node_ids": {"type": "array", "items": {"type": "string"}, "uniqueItems": true},
        "edges": {"type": "array", "items": {"$ref": "#/$defs/edge"}},
        "unresolved_dependency_ids": {"type": "array", "items": {"type": "string"}, "uniqueItems": true}
      }
    },
    "contradictions": {"type": "array", "items": {"$ref": "#/$defs/contradiction"}},
    "interventions": {"type": "array", "items": {"$ref": "#/$defs/intervention"}},
    "calibration": {"type": "object", "required": ["entries", "counts", "note"]},
    "unknowns": {"type": "array", "items": {"type": "string"}},
    "summary": {"type": "object", "required": ["capability_record_count", "status_counts"]},
    "extensions": {"type": "object"}
  },
  "$defs": {
    "state": {"enum": ["PASS", "FAIL", "UNKNOWN", "NOT_TESTED", "NOT_APPLICABLE", "BLOCKED"]},
    "scope": {
      "type": "object",
      "required": ["kind", "target"],
      "properties": {"kind": {"type": "string", "minLength": 1}, "target": {"type": "string", "minLength": 1}, "qualifiers": {"type": "object"}}
    },
    "evidence": {
      "type": "object",
      "required": ["id", "kind", "source", "method"],
      "properties": {"kind": {"enum": ["declared", "observed", "inferred", "unknown"]}}
    },
    "capability": {
      "type": "object",
      "required": ["id", "family", "name", "state", "scope", "dimensions", "evidence"],
      "properties": {
        "id": {"type": "string", "minLength": 1},
        "family": {"type": "string", "minLength": 1},
        "name": {"type": "string", "minLength": 1},
        "state": {"$ref": "#/$defs/state"},
        "scope": {"$ref": "#/$defs/scope"},
        "dimensions": {
          "type": "object",
          "required": ["declared", "availability", "resolution", "permission", "authorization", "attempt", "execution", "success"]
        },
        "dependency_ids": {"type": "array", "items": {"type": "string"}},
        "source_dependency_ids": {"type": "array", "items": {"type": "string"}},
        "canonical_dependency_ids": {"type": "array", "items": {"type": "string"}},
        "evidence": {"type": "array", "items": {"$ref": "#/$defs/evidence"}}
      },
      "allOf": [{"if": {"properties": {"state": {"const": "PASS"}}}, "then": {"properties": {"scope": {"$ref": "#/$defs/scope"}}}}]
    },
    "edge": {
      "type": "object",
      "required": ["source_id", "target_id", "relation"],
      "properties": {"source_id": {"type": "string"}, "target_id": {"type": "string"}, "relation": {"const": "requires"}}
    },
    "contradiction": {
      "type": "object",
      "required": ["id", "code", "subject_capability_id", "capability_refs", "evidence_refs", "source_record"],
      "properties": {
        "subject_capability_id": {"type": ["string", "null"]},
        "capability_refs": {"type": "array", "items": {"type": "string"}},
        "evidence_refs": {"type": "array", "items": {"type": "string", "pattern": "^agent-evidence:"}},
        "source_record": {"type": "object"}
      }
    },
    "intervention": {
      "type": "object",
      "required": ["id", "reason", "actor", "before", "action", "after", "effect_on_agent_capability", "scope"],
      "properties": {
        "before_context": {"anyOf": [{"$ref": "#/$defs/contextDescriptor"}, {"type": "null"}]},
        "after_context": {"anyOf": [{"$ref": "#/$defs/contextDescriptor"}, {"type": "null"}]},
        "capability_transitions": {"type": "array", "items": {"$ref": "#/$defs/capabilityTransition"}}
      }
    },
    "contextDescriptor": {
      "type": "object",
      "required": ["id", "label", "activation", "environment_markers", "evidence_kind"],
      "properties": {"evidence_kind": {"enum": ["declared", "observed", "inferred", "unknown"]}}
    },
    "capabilityTransition": {
      "type": "object",
      "required": ["capability_id", "before_context_id", "before_state", "after_context_id", "after_state", "interpretation", "evidence_refs"],
      "properties": {
        "before_state": {"$ref": "#/$defs/state"},
        "after_state": {"$ref": "#/$defs/state"},
        "evidence_refs": {"type": "array", "items": {"type": "string"}}
      }
    }
  },
  "additionalProperties": false
}
