{
  "schema_version": "agent-dna/0.1",
  "snapshot_id": "agent-dna-snapshot:redacted-example",
  "producer": {"name": "ARX", "version": "4.0.0b5", "source_schema": "agent-dna-experiment/0.1"},
  "generated_at": "2026-08-28T00:00:00Z",
  "agent": {"name": "Generic CLI agent", "implementation": "redacted", "version": null, "model_identifier": null, "extensions": {}},
  "machine_reference": {"machine_dna_id": null, "evidence_refs": [], "status": "UNRESOLVED"},
  "execution_context": {"working_directory": "%EXPERIMENT_WORKSPACE%", "process_architecture": "x64", "interactive": true, "privilege_class": null, "sandbox_profile": "bounded", "approval_profile": "manual", "agent_reported_host": "Windows NT build 29639", "extensions": {}},
  "policy": {"profile": "bounded-nondestructive", "mutation_boundary": "safe-bounded", "remote_mutation": "not-authorized-unless-explicit", "dangerous_probes": "not-tested", "extensions": {}},
  "capabilities": [
    {"id": "filesystem.write", "family": "filesystem", "name": "Workspace write", "state": "PASS", "scope": {"kind": "workspace", "target": "%EXPERIMENT_WORKSPACE%", "qualifiers": {}}, "dimensions": {"declared": "EXPECTED_AVAILABLE", "availability": "AVAILABLE", "resolution": "UNKNOWN", "permission": "PERMITTED", "authorization": "AUTHORIZED", "attempt": "ATTEMPTED", "execution": "EXECUTED", "success": "YES"}, "result": "fixture created", "reason_code": "FILE_CREATED", "limitations": [], "dependency_ids": [], "evidence": [], "started_at": null, "finished_at": null, "duration_ms": null, "extensions": {}},
    {"id": "python.execute", "family": "python", "name": "Python execution", "state": "PASS", "scope": {"kind": "workspace", "target": "%EXPERIMENT_WORKSPACE%", "qualifiers": {}}, "dimensions": {"declared": "EXPECTED_AVAILABLE", "availability": "AVAILABLE", "resolution": "RESOLVED", "permission": "PERMITTED", "authorization": "AUTHORIZED", "attempt": "ATTEMPTED", "execution": "EXECUTED", "success": "YES"}, "result": "deterministic output", "reason_code": "EXIT_ZERO", "limitations": [], "dependency_ids": [], "evidence": [], "started_at": null, "finished_at": null, "duration_ms": null, "extensions": {}},
    {"id": "cpp.compile", "family": "cpp", "name": "C++ compilation", "state": "FAIL", "scope": {"kind": "workspace", "target": "%EXPERIMENT_WORKSPACE%", "qualifiers": {}}, "dimensions": {"declared": "UNKNOWN", "availability": "AVAILABLE", "resolution": "RESOLVED", "permission": "PERMITTED", "authorization": "AUTHORIZED", "attempt": "ATTEMPTED", "execution": "EXECUTED", "success": "NO"}, "result": "standard library unresolved", "reason_code": "TOOLCHAIN_INCOMPLETE", "limitations": [], "dependency_ids": ["cpp.compiler.visible", "cpp.standard_library.available"], "evidence": [], "started_at": null, "finished_at": null, "duration_ms": null, "extensions": {}},
    {"id": "dotnet.offline_build", "family": "dotnet", "name": ".NET offline build", "state": "BLOCKED", "scope": {"kind": "workspace", "target": "%EXPERIMENT_WORKSPACE%", "qualifiers": {}}, "dimensions": {"declared": "UNKNOWN", "availability": "AVAILABLE", "resolution": "RESOLVED", "permission": "PERMITTED", "authorization": "NOT_AUTHORIZED", "attempt": "ATTEMPTED", "execution": "EXECUTED", "success": "UNKNOWN"}, "result": "restore prerequisite absent", "reason_code": "RESTORE_NOT_AUTHORIZED", "limitations": [], "dependency_ids": ["dotnet.project.assets"], "evidence": [], "started_at": null, "finished_at": null, "duration_ms": null, "extensions": {}},
    {"id": "github.push", "family": "github", "name": "Remote push", "state": "NOT_TESTED", "scope": {"kind": "remote_repository", "target": "example/project", "qualifiers": {}}, "dimensions": {"declared": "EXPECTED_RESTRICTED", "availability": "OBSERVED_PERMISSION", "resolution": "UNKNOWN", "permission": "OBSERVED_POSSIBLE", "authorization": "NOT_AUTHORIZED", "attempt": "NOT_TESTED", "execution": "NOT_EXECUTED", "success": "UNKNOWN"}, "result": "NOT_TESTED", "reason_code": "REMOTE_MUTATION_PROHIBITED", "limitations": [], "dependency_ids": [], "evidence": [], "started_at": null, "finished_at": null, "duration_ms": null, "extensions": {}},
    {"id": "cuda.compile", "family": "cuda", "name": "CUDA compilation", "state": "FAIL", "scope": {"kind": "workspace", "target": "%EXPERIMENT_WORKSPACE%", "qualifiers": {}}, "dimensions": {"declared": "UNKNOWN", "availability": "AVAILABLE", "resolution": "RESOLVED", "permission": "PERMITTED", "authorization": "AUTHORIZED", "attempt": "ATTEMPTED", "execution": "EXECUTED", "success": "NO"}, "result": "host compiler unresolved", "reason_code": "HOST_COMPILER_UNRESOLVED", "limitations": [], "dependency_ids": ["cuda.nvcc_resolution", "cuda.host_compiler.resolution"], "evidence": [], "started_at": null, "finished_at": null, "duration_ms": null, "extensions": {}},
    {"id": "cuda.runtime_initialize", "family": "cuda", "name": "CUDA runtime initialization", "state": "PASS", "scope": {"kind": "workspace", "target": "%EXPERIMENT_WORKSPACE%", "qualifiers": {}}, "dimensions": {"declared": "UNKNOWN", "availability": "AVAILABLE", "resolution": "RESOLVED", "permission": "PERMITTED", "authorization": "AUTHORIZED", "attempt": "ATTEMPTED", "execution": "EXECUTED", "success": "YES"}, "result": "one device", "reason_code": "CUDA_RUNTIME_API_OK", "limitations": [], "dependency_ids": ["cuda.driver_capability"], "evidence": [], "started_at": null, "finished_at": null, "duration_ms": null, "extensions": {}},
    {"id": "frameworks.tensorrt", "family": "frameworks", "name": "TensorRT visibility", "state": "UNKNOWN", "scope": {"kind": "named", "target": "tested_python_provider", "qualifiers": {}}, "dimensions": {"declared": "UNKNOWN", "availability": "UNKNOWN", "resolution": "UNKNOWN", "permission": "PERMITTED", "authorization": "AUTHORIZED", "attempt": "ATTEMPTED", "execution": "EXECUTED", "success": "UNKNOWN"}, "result": "insufficient evidence", "reason_code": "UNKNOWN_PROVIDER", "limitations": [], "dependency_ids": [], "evidence": [], "started_at": null, "finished_at": null, "duration_ms": null, "extensions": {}}
  ],
  "capability_graph": {"node_ids": ["filesystem.write", "python.execute", "cpp.compile", "dotnet.offline_build", "github.push", "cuda.compile", "cuda.runtime_initialize", "frameworks.tensorrt"], "edges": [], "unresolved_dependency_ids": ["cuda.host_compiler.resolution"]},
  "contradictions": [], "interventions": [],
  "calibration": {"entries": [], "counts": {"UNKNOWN_RESOLVED_AVAILABLE": 1}, "note": "Categorical comparison only; not a probability or intelligence score."},
  "unknowns": ["frameworks.tensorrt"],
  "summary": {"capability_record_count": 8, "status_counts": {"PASS": 3, "FAIL": 2, "BLOCKED": 1, "NOT_TESTED": 1, "UNKNOWN": 1}, "intervention_count": 0, "contradiction_count": 0},
  "extensions": {}
}
